{
  "schema_version": "lnv.collector.dataset.v1",
  "collector": {
    "tech_id": "Lenovo.DE",
    "module": "LNV.AsBuiltDoc.Lenovo.DE",
    "entry_point": "Invoke-LnvAsBuiltDoc.Lenovo.DE"
  },
  "source": {
    "bundle_id": "target_de-prod-01",
    "bundle_root": "C:\\Github\\LNV.AsBuiltDoc.Core\\out\\e32facfb-29e5-4e8f-ad71-a695aa391920\\datasets\\Lenovo.DE\\collector-out\\de-prod-01\\target_de-prod-01",
    "file": "system_1_DE4200_Rack4/hosts-to-host-groups.json"
  },
  "dataset": {
    "key": "hosts-to-host-groups",
    "schema_path": "tech/Lenovo.DE/dataset/hosts-to-host-groups.schema.json"
  },
  "item_count": 2,
  "items": [
    {
      "systemId": "1",
      "hostId": "840000006D039EA000D9EFC20030016B69B099F5",
      "hostRef": "840000006D039EA000D9EFC20030016B69B099F5",
      "hostName": "HostJupiter2",
      "hostType": "Windows (clustered or non-clustered)",
      "clusterRef": "850000006D039EA000D9F0180036013769B09A1D",
      "hostGroupId": "850000006D039EA000D9F0180036013769B09A1D",
      "hostGroupRef": "850000006D039EA000D9F0180036013769B09A1D",
      "hostGroupName": "HostClusterGalaxy",
      "hostGroupKeyType": "clusterRef"
    },
    {
      "systemId": "1",
      "hostId": "840000006D039EA000D9F0180030013369B099E9",
      "hostRef": "840000006D039EA000D9F0180030013369B099E9",
      "hostName": "HostNeptune1",
      "hostType": "Windows (clustered or non-clustered)",
      "clusterRef": "850000006D039EA000D9F0180036013769B09A1D",
      "hostGroupId": "850000006D039EA000D9F0180036013769B09A1D",
      "hostGroupRef": "850000006D039EA000D9F0180036013769B09A1D",
      "hostGroupName": "HostClusterGalaxy",
      "hostGroupKeyType": "clusterRef"
    }
  ]
}
